{
  "producer": "P1",
  "mock_status": "MOCK",
  "contract_version": "1.0",
  "generation_commit": "FIXTURE-MOCK",
  "input_domain": "VISION",
  "is_quantized": false,
  "layer_count": 3,
  "static_features": [
    {
      "layer_name": "layer1.0.conv1.weight",
      "entropy": 0.71,
      "pov_chi2": 0.12,
      "lsb_kl": 0.05,
      "ks_stat": 0.09,
      "mean": 0.01,
      "std": 0.24,
      "skewness": -0.08,
      "kurtosis": 2.91,
      "sparsity": 0.08,
      "outlier_pct": 0.30
    },
    {
      "layer_name": "layer2.1.conv2.weight",
      "entropy": 0.88,
      "pov_chi2": 0.44,
      "lsb_kl": 0.32,
      "ks_stat": 0.35,
      "mean": -0.02,
      "std": 0.27,
      "skewness": 0.11,
      "kurtosis": 3.12,
      "sparsity": 0.10,
      "outlier_pct": 0.40
    },
    {
      "layer_name": "layer4.1.conv2.weight",
      "entropy": 0.95,
      "pov_chi2": 0.88,
      "lsb_kl": 0.81,
      "ks_stat": 0.77,
      "mean": 0.03,
      "std": 0.31,
      "skewness": 0.22,
      "kurtosis": 3.44,
      "sparsity": 0.12,
      "outlier_pct": 0.55
    }
  ]
}